{
  "schema_version": "stage-run.v1",
  "stage_run_id": "stage_context_001",
  "run_id": "run_demo_001",
  "stage_name": "context_compile",
  "attempt": 1,
  "status": "succeeded",
  "input_artifact_ids": ["artifact_memory_003"],
  "input_hash": "8888888888888888888888888888888888888888888888888888888888888888",
  "output_artifact_ids": ["artifact_context_001"],
  "agent_session_id": null,
  "error_code": null,
  "error_detail": null,
  "started_at": "2026-07-19T10:00:30Z",
  "ended_at": "2026-07-19T10:00:31Z"
}
